{"action":"SELL","canonical_json_hash":"c483beb3b5f8ad3feaf926a67bced494b570e1c76ee00c594b3739ec2fa6013d","created_at_utc":"2026-03-03T00:00:00Z","currency":"USD","engine_id":"C2_TREND_EQ_PRIMARY_V1","intent_hash":"8185b091bef0f04e032f86299ef930849e23a124dddcfa161cdd8ee6906e63a5","intent_sha256":"4859f2c48d6881b73907a81edeaf2627cdbbe90c7f4448c44c6b2a5bb08e7a39","order_terms":{"limit_price":null,"order_type":"MARKET","time_in_force":"DAY"},"plan_id":"7af3c7f3fe48ad7a1136befcfff07d6132d8aef13ab21ecf743829bca5a506f4","qty_shares":1,"risk_proof":null,"schema_id":"equity_order_plan","schema_version":"v2","source_intent_id":"7af3c7f3fe48ad7a1136befcfff07d6132d8aef13ab21ecf743829bca5a506f4","structure":"EQUITY_SPOT","symbol":"SPY"}
