{"action":"SELL","canonical_json_hash":"e4b072e9a50f6dd982cf3f3b6980ac6d7a6302fcc6df61dcffd636be1c267390","created_at_utc":"2026-02-21T00:00:00Z","currency":"USD","engine_id":"C2_TREND_EQ_PRIMARY_V1","intent_hash":"f7133c85f4d2fe94f3da4732d26b437e733d8de713162ba78849c3aa22eac0cc","intent_sha256":"baac57fd100eeccd728ade6d196247425ae2c92822ea8e357527682d914299e7","order_terms":{"limit_price":null,"order_type":"MARKET","time_in_force":"DAY"},"plan_id":"9f508d3cf9f6292e8da675a24b5ee8c3a6d8bc52dcbc6ee921a55ec26d39a9e7","qty_shares":1,"risk_proof":null,"schema_id":"equity_order_plan","schema_version":"v2","source_intent_id":"9f508d3cf9f6292e8da675a24b5ee8c3a6d8bc52dcbc6ee921a55ec26d39a9e7","structure":"EQUITY_SPOT","symbol":"SPY"}
