{"action":"SELL","canonical_json_hash":"23d17d965d6995f3b6d234702838613405ec495deb0f4d0b561cc3d9110c862d","created_at_utc":"2026-02-28T00:00:00Z","currency":"USD","engine_id":"C2_TREND_EQ_PRIMARY_V1","intent_hash":"9b5313fa93bd843697f4e082d56b4a027e3f229a2b22582b539c7f57d06e607a","intent_sha256":"91704ad1500f1cc45948c3dfeb4944ce3cc48f86ee1008a643101aa59a6b0c2d","order_terms":{"limit_price":null,"order_type":"MARKET","time_in_force":"DAY"},"plan_id":"b7587c30808a3eb953ac212496b3d29a7750c5092e8fcc82dffc05a46d29ca58","qty_shares":1,"risk_proof":null,"schema_id":"equity_order_plan","schema_version":"v2","source_intent_id":"b7587c30808a3eb953ac212496b3d29a7750c5092e8fcc82dffc05a46d29ca58","structure":"EQUITY_SPOT","symbol":"SPY"}
