{"action":"SELL","canonical_json_hash":"5dc501649afc3cd3ec41ff4db46a61bcdc70980de281660829bed1cbd4a335ad","created_at_utc":"2026-02-27T00:00:00Z","currency":"USD","engine_id":"C2_TREND_EQ_PRIMARY_V1","intent_hash":"321bc6ea45dcbb746a12a12003c3b3f7d9bae37b6b055f70c49dc344fcb75f07","intent_sha256":"2ebfdc5598d71ef59e7e94972411551716229b14b3a239ea5573c3d06da8a400","order_terms":{"limit_price":null,"order_type":"MARKET","time_in_force":"DAY"},"plan_id":"4c4cea103136576e4bc6bffd3faab2f5ae71f4bda8e8953c0243034b979db6cf","qty_shares":1,"risk_proof":null,"schema_id":"equity_order_plan","schema_version":"v2","source_intent_id":"4c4cea103136576e4bc6bffd3faab2f5ae71f4bda8e8953c0243034b979db6cf","structure":"EQUITY_SPOT","symbol":"SPY"}
