{"action":"SELL","canonical_json_hash":"a34d7ed18a67c0c22af886254bbee538021856aa09a44093bc5b0812e4e99777","created_at_utc":"2026-02-25T00:00:00Z","currency":"USD","engine_id":"C2_TREND_EQ_PRIMARY_V1","intent_hash":"746176f5fb24021c7b8c04f6f478dcf65dd04f9545dfc79d566c5e880efa4aae","intent_sha256":"6a803d45b0dca88a7dcd43a3c4e20e7c8ff53f24bef7781e0c4d74f3d551594f","order_terms":{"limit_price":null,"order_type":"MARKET","time_in_force":"DAY"},"plan_id":"0d3037aaaf60f561d49525889ac2eff1bdd149f0bc9075002aa2b3f4a6999fd7","qty_shares":1,"risk_proof":null,"schema_id":"equity_order_plan","schema_version":"v2","source_intent_id":"0d3037aaaf60f561d49525889ac2eff1bdd149f0bc9075002aa2b3f4a6999fd7","structure":"EQUITY_SPOT","symbol":"SPY"}
